[{"id":"sm.clay-idol","name":{"te":"మట్టి విగ్రహం","hi":"मिट्टी की प्रतिमा","en":"Clay idol"},"image":"img.samagri.clay-idol","alternatives":["sm.pasupu"],"note":{"te":"నీటిలో కరిగేది మేలు","hi":"पानी में घुलने वाली बेहतर","en":"One that dissolves in water is best"}},{"id":"sm.pasupu","name":{"te":"పసుపు","hi":"हल्दी","en":"Turmeric"},"image":"img.samagri.pasupu","alternatives":[],"note":null},{"id":"sm.kumkuma","name":{"te":"కుంకుమ","hi":"कुमकुम","en":"Kumkum"},"image":"img.samagri.kumkuma","alternatives":[],"note":null},{"id":"sm.akshata","name":{"te":"అక్షతలు","hi":"अक्षत","en":"Akshata (rice with turmeric)"},"image":"img.samagri.akshata","alternatives":[],"note":{"te":"బియ్యానికి పసుపు కలపండి","hi":"चावल में हल्दी मिलाएँ","en":"Mix rice with a little turmeric"}},{"id":"sm.durva","name":{"te":"గరిక","hi":"दूर्वा","en":"Durva grass"},"image":"img.samagri.durva","alternatives":["sm.akshata"],"note":null},{"id":"sm.patri-21","name":{"te":"21 పత్రాలు","hi":"21 पत्र","en":"21 leaves"},"image":"img.samagri.patri","alternatives":["sm.durva"],"note":{"te":"దొరికినవి చాలు","hi":"जो मिलें वही काफ़ी","en":"Whatever you can find is enough"}},{"id":"sm.flowers","name":{"te":"పువ్వులు","hi":"फूल","en":"Flowers"},"image":"img.samagri.flowers","alternatives":["sm.akshata"],"note":null},{"id":"sm.kalasham","name":{"te":"కలశం","hi":"कलश","en":"Kalasha (water pot)"},"image":"img.samagri.kalasham","alternatives":[],"note":null},{"id":"sm.coconut","name":{"te":"కొబ్బరికాయ","hi":"नारियल","en":"Coconut"},"image":"img.samagri.coconut","alternatives":[],"note":null},{"id":"sm.betel","name":{"te":"తమలపాకులు వక్కలు","hi":"पान सुपारी","en":"Betel leaves and nuts"},"image":"img.samagri.betel","alternatives":[],"note":null},{"id":"sm.banana","name":{"te":"అరటిపండ్లు","hi":"केले","en":"Bananas"},"image":"img.samagri.banana","alternatives":[],"note":null},{"id":"sm.mango-leaves","name":{"te":"మామిడాకులు","hi":"आम के पत्ते","en":"Mango leaves"},"image":"img.samagri.mango-leaves","alternatives":[],"note":null},{"id":"sm.palavelli","name":{"te":"పాలవెల్లి","hi":"पालवेल्लि","en":"Palavelli frame"},"image":"img.samagri.palavelli","alternatives":["sm.mango-leaves"],"note":{"te":"ఆంధ్ర-తెలంగాణ ఆచారం","hi":"आंध्र-तेलंगाना की परंपरा","en":"An Andhra–Telangana custom"}},{"id":"sm.deepam","name":{"te":"దీపం","hi":"दीपक","en":"Lamp with ghee or oil"},"image":"img.samagri.deepam","alternatives":[],"note":null},{"id":"sm.agarbatti","name":{"te":"అగరబత్తి","hi":"अगरबत्ती","en":"Incense"},"image":"img.samagri.agarbatti","alternatives":[],"note":null},{"id":"sm.karpuram","name":{"te":"కర్పూరం","hi":"कपूर","en":"Camphor"},"image":"img.samagri.karpuram","alternatives":[],"note":null},{"id":"sm.panchamritam","name":{"te":"పంచామృతం","hi":"पंचामृत","en":"Panchamritam"},"image":"img.samagri.panchamritam","alternatives":[],"note":{"te":"పాలు పెరుగు నెయ్యి తేనె పంచదార","hi":"दूध दही घी शहद शक्कर","en":"Milk, curd, ghee, honey, sugar"}},{"id":"sm.vastram","name":{"te":"వస్త్రం (పత్తి దారాలు)","hi":"वस्त्र (सूती धागे)","en":"Cotton cloth / threads"},"image":"img.samagri.vastram","alternatives":[],"note":null},{"id":"sm.yajnopavitam","name":{"te":"యజ్ఞోపవీతం","hi":"यज्ञोपवीत","en":"Sacred thread"},"image":"img.samagri.yajnopavitam","alternatives":["sm.vastram"],"note":null},{"id":"sm.gandham","name":{"te":"గంధం","hi":"चंदन","en":"Sandal paste"},"image":"img.samagri.gandham","alternatives":["sm.pasupu"],"note":null},{"id":"sm.rice","name":{"te":"బియ్యం","hi":"चावल","en":"Rice"},"image":"img.samagri.rice","alternatives":[],"note":null},{"id":"sm.vessel","name":{"te":"శుభ్రమైన పాత్ర","hi":"साफ़ पात्र","en":"Any clean vessel"},"image":"img.samagri.vessel","alternatives":[],"note":null},{"id":"sm.seasonal-fruit","name":{"te":"కాలపు పండ్లు","hi":"मौसमी फल","en":"Any seasonal fruit"},"image":"img.samagri.seasonal-fruit","alternatives":[],"note":null},{"id":"sm.water","name":{"te":"శుద్ధమైన నీళ్ళు","hi":"शुद्ध जल","en":"Clean water"},"image":"img.samagri.water","alternatives":[],"note":null}]